{
  "language" : "zh-Hant",
  "revision" : 4,
  "schemaVersion" : 1,
  "strings" : {
    "CMYK" : "CMYK",
    "CMYK Gamut Warning" : "CMYK 色域警告",
    "CMYK Proof" : "CMYK 校樣",
    "CMYK writes the printer's inks through the profile beside it, for print" : "使用旁邊的描述檔將影像轉換為印表機的 CMYK 油墨色彩，以便印刷",
    "CMYK · %@" : "CMYK · %@",
    "Choose a CMYK ICC profile, such as the one your printer gave you" : "選擇 CMYK ICC 描述檔，例如印表機提供的描述檔",
    "Choose Profile" : "選擇描述檔",
    "Gamut Warning" : "色域警告",
    "Hide the gamut warning" : "隱藏色域警告",
    "Load Profile…" : "載入描述檔…",
    "No profile" : "無描述檔",
    "Other formats: TIFF and PDF" : "其他格式：TIFF 和 PDF",
    "Other formats: TIFF and PDF, and EXR to keep light brighter than white" : "其他格式：TIFF、PDF，以及可保留超白亮度的 EXR",
    "Profile" : "描述檔",
    "Proof Colors" : "校樣色彩",
    "Show the document's own colors again" : "重新顯示文件本身的色彩",
    "Stop marking colors the profile can't print" : "停止標記描述檔無法列印的色彩",
    "Stop proofing" : "停止校樣",
    "The CMYK profile your printer uses; View › CMYK › Proof Colors shows it on the canvas" : "印表機使用的 CMYK 描述檔；透過「顯示方式 › CMYK › 校樣色彩」可在畫布上預覽",
    " · %lld DPI: %lld × %lld pixels" : " · %lld DPI：%lld × %lld 像素",
    "·" : "·",
    "“%@” was changed on disk." : "磁碟上的“%@”已被更改。",
    "#" : "#",
    "%" : "%",
    "%@ %@ is now available — you have %@. Would you like to download it now?" : "%@ %@ 現已可用；目前版本為 %@。要立即下載嗎？",
    "%@ %@ is ready to install — you have %@." : "%@ %@ 已準備好安裝；目前版本為 %@。",
    "%@ color" : "%@顏色",
    "%@ the selection by this many pixels" : "將選取範圍%@指定的像素數",
    "%@ uncompressed RGBA canvas" : "未壓縮 RGBA 畫布：%@",
    "%lld more tabs" : "另有 %lld 個標籤頁",
    "×" : "×",
    "1 more tab" : "另有 1 個標籤頁",
    "3 by 3 Average" : "3 × 3 平均",
    "5 by 5 Average" : "5 × 5 平均",
    "16 bits per channel" : "每通道 16 位",
    "16-bit layer: keeps 16 bits a channel" : "16 位圖層：每個通道保留 16 位",
    "100%" : "100%",
    "A little stronger than Version 1. The sliders below still fall well short of the current look." : "比版本 1 稍強。下方滑桿的效果仍明顯弱於目前版本。",
    "A new version of %@ is available!" : "%@ 有新版本可用！",
    "A subdivision every %@ pixels." : "每 %@ 像素一個細分。",
    "Access token" : "存取權杖",
    "Actual Pixels" : "實際像素",
    "Actual pixels (⌘1)" : "實際像素（⌘1）",
    "Add" : "加入",
    "Add layer effect" : "加入圖層效果",
    "Add layer mask" : "加入圖層遮色片",
    "Add layer mask (Option-click for a black mask)" : "加入圖層遮色片（按住 Option 點按可加入黑色遮色片）",
    "Add layer mask revealing the selection (Option-click to hide it)" : "加入顯示選取範圍的圖層遮色片（按住 Option 點按可隱藏選取範圍）",
    "Add Mask" : "加入遮色片",
    "Add Noise" : "加入雜訊",
    "Add to %@" : "加入到 %@",
    "Adjustment · Double-click to edit" : "調整 · 連按兩下編輯",
    "Advanced" : "進階",
    "Align " : "對齊",
    "Aligned" : "對齊",
    "All" : "全部",
    "All Layers" : "所有圖層",
    "Amount" : "數量",
    "Analyze the active layer only, or every visible layer as shown" : "僅分析目前圖層，或分析畫面中顯示的所有可見圖層",
    "Anchor" : "錨點",
    "Another app changed this project. You can revert to the version on disk, losing your unsaved changes, or keep what you have." : "另一個應用程式更改了此專案。你可以還原到磁碟上的版本並丟棄未儲存的更改，也可以保留目前版本。",
    "Anti-alias" : "抗鋸齒",
    "Applies generic profile strength when camera metadata is not available." : "沒有相機中繼資料時套用通用描述檔強度。",
    "Apply" : "套用",
    "Apply Crop" : "套用裁切",
    "Apply outside this range instead" : "改為套用到此範圍之外",
    "Applying…" : "正在套用…",
    "ASCII" : "ASCII",
    "Atkinson (Classic Mac)" : "Atkinson（經典 Mac）",
    "Auto" : "自動",
    "Auto balances the average color. Custom follows Temperature and Tint." : "“自動”會平衡平均顏色；“自定”使用色溫和色調設定。",
    "Auto Select" : "自動選擇",
    "Automatically download and install updates in the future" : "以後自動下載並安裝更新",
    "Background" : "背景",
    "Bake and Delete" : "烘焙並刪除",
    "Bake keeps the current masked appearance in the dependent layers’ pixels. Remove Links reveals their pixels. You can undo either choice." : "“烘焙”會將目前遮色片外觀寫入相依圖層的像素；“移除連結”會顯示這些像素。兩種操作均可復原。",
    "Based On" : "基於",
    "Basic" : "基本",
    "Basic is quick; Advanced refines the mask against the layer's own detail, for hair and fur" : "“基本”速度快；“進階”會根據圖層細節最佳化遮色片，適合頭髮和毛髮",
    "Bayer 2 × 2" : "Bayer 2 × 2",
    "Bayer 4 × 4" : "Bayer 4 × 4",
    "Bayer 8 × 8" : "Bayer 8 × 8",
    "Black" : "黑色",
    "Black · Hide" : "黑色 · 隱藏",
    "Black & White" : "黑白",
    "Black canvas" : "黑色畫布",
    "Blend" : "混合",
    "Blend mode" : "混合模式",
    "Blend the chosen color into the edges while keeping the center unchanged" : "將所選顏色混入邊緣，同時保持中心不變",
    "Bloom" : "泛光",
    "Bloom / Glow" : "泛光 / 光暈",
    "Blue" : "藍色",
    "Blue Primary" : "藍原色",
    "Blues" : "藍色",
    "Blur" : "模糊",
    "Blur only the colors, keeping the layer's outline and transparency as they are" : "只模糊顏色，保持圖層輪廓和透明度不變",
    "Bottom" : "下",
    "Bottom center" : "下中",
    "Bottom left" : "左下",
    "Bottom right" : "右下",
    "Bottom Right Pixel Color" : "右下角像素顏色",
    "Break the lines into beads where the picture is darker than this, blending into solid lines where it's brighter" : "在低於此亮度的區域將線條分成珠點，在較亮區域逐漸連成實線",
    "Brighter than white kept · Transparency kept" : "保留超白亮度 · 保留透明度",
    "Brings back detail in bright areas the camera partly clipped" : "恢復相機在明亮區域中部分剪切的細節",
    "Brush" : "筆刷",
    "Brush (B) · Eraser (E)" : "筆刷 (B) · 橡皮擦 (E)",
    "Calibration" : "校正",
    "Camera Raw Filter" : "Camera Raw 濾鏡",
    "Cancel" : "取消",
    "Canvas" : "畫布",
    "Canvas extension" : "畫布擴展",
    "Canvas Size" : "畫布大小",
    "Canvas Size…" : "畫布大小…",
    "Canvas text" : "畫布文字",
    "Center" : "置中",
    "Centimeters" : "公分",
    "Channel" : "通道",
    "Characters" : "字元",
    "Check for Updates…" : "檢查更新…",
    "Choose a custom grid color" : "選擇自定網格顏色",
    "Choose the %@ color" : "選擇%@顏色",
    "Choose the vignette color" : "選擇暈影顏色",
    "Chooses how strongly the calibration sliders below are applied. Version 6 is the current default." : "選擇下方校正滑桿的套用強度。版本 6 是目前預設值。",
    "Clarity" : "清晰度",
    "Clear Guides" : "清除參考線",
    "Clear Menu" : "清除選單",
    "Clear Selection Pixels" : "清除選取範圍像素",
    "Clear the haze that leaves background showing through thin areas" : "清除薄弱區域中透出背景的霧狀邊緣",
    "Click a pixel that should be neutral." : "點按一個應為中性色的像素。",
    "Click a purple or green fringe to set its hue range." : "點按紫色或綠色邊緣以設定其色相範圍。",
    "Click a shortcut, then press its new key combination. Changes apply when you save." : "點按一個快速鍵，然後按下新的組合鍵。儲存後更改生效。",
    "Click an object to select its outline · Tab for Wand · Shift add · Option subtract · Drag inside to move · ⌘-drag moves pixels · Delete clears · ⌘D deselect" : "點按物件以選擇其輪廓 · Tab 切換魔術棒 · Shift 加入 · Option 減去 · 在內部拖移可移動 · ⌘ 拖移移動像素 · Delete 清除 · ⌘D 取消選擇",
    "Click anchors · Drag handles for curves · Click the first anchor to close · Return or double-click finish · Delete last anchor · Escape cancel" : "點按放置錨點 · 拖移控制點繪製曲線 · 點按第一個錨點閉合 · Return 或連按兩下完成 · Delete 刪除最後一個錨點 · Escape 取消",
    "Click corners · Click start, double-click or Enter to close · Delete removes corner · Escape cancel" : "點按放置角點 · 點按起點、連按兩下或按 Enter 閉合 · Delete 移除角點 · Escape 取消",
    "Click for a corner · Drag for a curve" : "點按建立角點 · 拖移建立曲線",
    "Click or drag to move the view" : "點按或拖移以移動視圖",
    "Click the canvas to sample" : "點按畫布進行取樣",
    "Click the fringe on the layer. Click the eyedropper again to stop." : "點按圖層上的色邊；再次點按滴管可停止。",
    "Click the image to pick the color to select." : "點按影像以選取要選擇的顏色。",
    "Click the original layer to set %@. Click the eyedropper again to stop." : "點按原始圖層以設定%@；再次點按滴管可停止。",
    "Click the original layer. Click the eyedropper again to stop." : "點按原始圖層；再次點按滴管可停止。",
    "Click the picture to save a color. Up to eight colors." : "點按影像以儲存顏色，最多可儲存八種。",
    "Click to add a point. Drag to adjust." : "點按加入控制點，拖移進行調整。",
    "Click to select similar colors · Tab for Object · Shift add · Option subtract · Drag inside to move · ⌘-drag moves pixels · Delete clears · ⌘D deselect" : "點按以選擇相似顏色 · Tab 切換物件 · Shift 加入 · Option 減去 · 在內部拖移可移動 · ⌘ 拖移移動像素 · Delete 清除 · ⌘D 取消選擇",
    "Click to select; double-click to edit; Option-drag to copy %@" : "點按以選擇；連按兩下以編輯；按住 Option 拖移可複製%@",
    "Click to zoom in · Option-click to zoom out · Drag right or left to zoom smoothly · Space to pan" : "點按放大 · 按住 Option 點按縮小 · 向右或向左拖移以平滑縮放 · 空格鍵平移",
    "Clipped to %@" : "剪裁至 %@",
    "Clipping mask based on %@. Option-click the bottom of its row to release." : "基於“%@”的剪裁遮色片。按住 Option 點按其行底部可釋放。",
    "Clone Stamp" : "仿製圖章",
    "Clone Stamp (S) · Option-click sets the source" : "仿製圖章 (S) · Option 點按設定來源",
    "Close %@" : "關閉 %@",
    "Close Project" : "關閉專案",
    "Close to the current process, with slightly softer primary and shadow shifts." : "接近目前處理方式，但原色和陰影偏移稍柔和。",
    "Color" : "顏色",
    "Color + neutral midtones" : "顏色 + 中性中間調",
    "Color Balance" : "色彩平衡",
    "Color Burn" : "顏色加深",
    "Color Dodge" : "顏色減淡",
    "Color for the added canvas" : "新增畫布的顏色",
    "Color Grading" : "顏色分級",
    "Color Mixer" : "顏色混合器",
    "Color Overlay" : "顏色疊加",
    "Color Priority" : "顏色優先",
    "Color Range…" : "色彩範圍…",
    "Color that fills transparent areas" : "用於填充透明區域的顏色",
    "Color the result while keeping its tones, for a sepia or a cyanotype" : "在保留明暗層次的同時為結果著色，可製作棕褐色或藍曬效果",
    "Colorize" : "著色",
    "Colors" : "顏色",
    "Component" : "分量",
    "Compositor will convert these Photoshop features. Nothing is applied until you continue." : "Compositor 將轉換這些 Photoshop 功能。在你繼續之前不會套用任何更改。",
    "Connections are accepted only from this Mac. Clients must send the access token as a Bearer authorization header." : "僅接受來自此 Mac 的連線。用戶端必須在 Bearer 授權標頭中傳送存取權杖。",
    "Constrain Crop" : "約束裁切",
    "Content-Aware" : "內容識別",
    "Content-Aware Fill" : "內容識別填充",
    "Content-Aware Fill…" : "內容識別填充…",
    "Contextual keys & mouse gestures" : "上下文按鍵與滑鼠手勢",
    "Contiguous" : "連續",
    "Contract" : "收縮",
    "Contract…" : "收縮…",
    "Contrast" : "對比度",
    "Convert to 8-Bit" : "轉換為 8 位",
    "Convert to 16-Bit" : "轉換為 16 位",
    "Copy" : "拷貝",
    "Copy Connection JSON" : "拷貝連線 JSON",